{
  "id": "logseq",
  "name": "Logseq",
  "tagline": "Privacy-first, open-source knowledge management",
  "description": "A privacy-first, open-source platform for knowledge management and collaboration. Uses a local-first, outliner-based approach with bidirectional linking, graph views, and Markdown/Org-mode files.",
  "website": "https://logseq.com",
  "repository": "https://github.com/logseq/logseq",
  "license_spdx": "AGPL-3.0",
  "category": "productivity",
  "tags": ["note-taking", "knowledge-base", "notion-alternative", "outliner", "graph-view"],
  "capabilities": [
    "offline-editing",
    "bidirectional-linking",
    "graph-visualization",
    "plugin-system"
  ],
  "import_export_formats": [".md", ".org", ".json", ".edn"],
  "platforms": ["macOS", "Windows", "Linux"],
  "pricing": {
    "model": "free_open_source",
    "has_paid_tier": true,
    "paid_tier_description": "Logseq Sync for encrypted cloud synchronization"
  },
  "privacy": {
    "telemetry": false,
    "offline_usable": true,
    "cloud_sync_required": false
  },
  "self_hosting": {
    "supported": false
  },
  "installation": {
    "macOS": "brew install --cask logseq",
    "Windows": "winget install Logseq.Logseq",
    "Linux": "snap install logseq"
  },
  "replaces": [
    {
      "target": "notion",
      "migration_ease": "moderate",
      "import_supported": true,
      "notes": "Local-first privacy alternative. Markdown-based with bidirectional links and graph views."
    }
  ],
  "security": {
    "verified_publisher": true,
    "last_audit_date": "2026-08-02"
  },
  "health_status": "healthy"
}
