{
  "id": "blender",
  "name": "Blender",
  "tagline": "Free and open-source 3D creation suite",
  "description": "The industry-standard open-source 3D creation suite supporting modeling, sculpting, animation, rendering (Cycles/Eevee), compositing, motion tracking, video editing, and 2D animation (Grease Pencil).",
  "website": "https://www.blender.org",
  "repository": "https://github.com/blender/blender",
  "license_spdx": "GPL-2.0-or-later",
  "category": "design-media",
  "tags": ["3d-modeling", "animation", "rendering", "video-editing", "maya-alternative"],
  "capabilities": [
    "3d-modeling",
    "animation-rigging",
    "rendering-engine",
    "video-editing",
    "scripting"
  ],
  "import_export_formats": [".blend", ".fbx", ".obj", ".gltf", ".usd", ".stl", ".svg"],
  "platforms": ["macOS", "Windows", "Linux"],
  "pricing": {
    "model": "free_open_source",
    "has_paid_tier": false
  },
  "privacy": {
    "telemetry": false,
    "offline_usable": true,
    "cloud_sync_required": false
  },
  "self_hosting": {
    "supported": false
  },
  "installation": {
    "macOS": "brew install --cask blender",
    "Windows": "winget install BlenderFoundation.Blender",
    "Linux": "snap install blender"
  },
  "replaces": [
    {
      "target": "maya",
      "migration_ease": "complex",
      "import_supported": true,
      "notes": "Full 3D pipeline replacement. FBX import from Maya. Steeper learning curve but comparable capabilities."
    },
    {
      "target": "cinema4d",
      "migration_ease": "complex",
      "import_supported": true,
      "notes": "Cycles renderer competitive with Redshift. Geometry Nodes replaces MoGraph workflows."
    }
  ],
  "security": {
    "verified_publisher": true,
    "last_audit_date": "2026-08-02"
  },
  "health_status": "healthy"
}
